{
    "componentChunkName": "component---src-templates-note-template-js",
    "path": "/Framework-Laptop-13",
    "result": {"data":{"mdx":{"body":"var _excluded = [\"components\"];\n\nfunction _extends() { _extends = Object.assign || function (target) { for (var i = 1; i < arguments.length; i++) { var source = arguments[i]; for (var key in source) { if (Object.prototype.hasOwnProperty.call(source, key)) { target[key] = source[key]; } } } return target; }; return _extends.apply(this, arguments); }\n\nfunction _objectWithoutProperties(source, excluded) { if (source == null) return {}; var target = _objectWithoutPropertiesLoose(source, excluded); var key, i; if (Object.getOwnPropertySymbols) { var sourceSymbolKeys = Object.getOwnPropertySymbols(source); for (i = 0; i < sourceSymbolKeys.length; i++) { key = sourceSymbolKeys[i]; if (excluded.indexOf(key) >= 0) continue; if (!Object.prototype.propertyIsEnumerable.call(source, key)) continue; target[key] = source[key]; } } return target; }\n\nfunction _objectWithoutPropertiesLoose(source, excluded) { if (source == null) return {}; var target = {}; var sourceKeys = Object.keys(source); var key, i; for (i = 0; i < sourceKeys.length; i++) { key = sourceKeys[i]; if (excluded.indexOf(key) >= 0) continue; target[key] = source[key]; } return target; }\n\n/* @jsxRuntime classic */\n\n/* @jsx mdx */\nvar _frontmatter = {\n  \"title\": \"Framework Laptop 13\",\n  \"created\": \"2023-05-20T08:11\",\n  \"updated\": \"2023-05-20T08:11\",\n  \"tags\": [\"garden\", \"tech\", \"gadget\"],\n  \"stage\": \"seedling\"\n};\nvar layoutProps = {\n  _frontmatter: _frontmatter\n};\nvar MDXLayout = \"wrapper\";\nreturn function MDXContent(_ref) {\n  var components = _ref.components,\n      props = _objectWithoutProperties(_ref, _excluded);\n\n  return mdx(MDXLayout, _extends({}, layoutProps, props, {\n    components: components,\n    mdxType: \"MDXLayout\"\n  }), mdx(\"p\", null, \"I recently got a \", mdx(\"a\", {\n    parentName: \"p\",\n    \"href\": \"https://frame.work/products/laptop-diy-13-gen-intel\"\n  }, \"Framework Laptop 13 DIY Edition\"), \" to replace my Thinkpad T480 and System76 Adder WS 1. Here are some notes on installation, general thoughts.\"), mdx(\"h1\", {\n    \"id\": \"system-information\",\n    \"style\": {\n      \"position\": \"relative\"\n    }\n  }, mdx(\"a\", {\n    parentName: \"h1\",\n    \"href\": \"#system-information\",\n    \"aria-label\": \"system information permalink\",\n    \"className\": \"anchor before\"\n  }, mdx(\"svg\", {\n    parentName: \"a\",\n    \"aria-hidden\": \"true\",\n    \"focusable\": \"false\",\n    \"height\": \"16\",\n    \"version\": \"1.1\",\n    \"viewBox\": \"0 0 16 16\",\n    \"width\": \"16\"\n  }, mdx(\"path\", {\n    parentName: \"svg\",\n    \"fillRule\": \"evenodd\",\n    \"d\": \"M4 9h1v1H4c-1.5 0-3-1.69-3-3.5S2.55 3 4 3h4c1.45 0 3 1.69 3 3.5 0 1.41-.91 2.72-2 3.25V8.59c.58-.45 1-1.27 1-2.09C10 5.22 8.98 4 8 4H4c-.98 0-2 1.22-2 2.5S3 9 4 9zm9-3h-1v1h1c1 0 2 1.22 2 2.5S13.98 12 13 12H9c-.98 0-2-1.22-2-2.5 0-.83.42-1.64 1-2.09V6.25c-1.09.53-2 1.84-2 3.25C6 11.31 7.55 13 9 13h4c1.45 0 3-1.69 3-3.5S14.5 6 13 6z\"\n  }))), \"System Information\"), mdx(\"p\", null, \"After all is set up:\"), mdx(\"pre\", null, mdx(\"code\", {\n    parentName: \"pre\"\n  }, \"$ neofetch --off\\n\\nOS: Ubuntu 22.04.2 LTS x86_64 \\nHost: Laptop (13th Gen Intel Core) A6 \\nKernel: 6.1.0-1012-oem \\nUptime: 36 mins \\nPackages: 1980 (dpkg), 11 (snap) \\nShell: zsh 5.8.1 \\nResolution: 2256x1504 \\nDE: GNOME 42.5 \\nWM: Mutter \\nWM Theme: Adwaita \\nTheme: Yaru-blue-dark [GTK2/3] \\nIcons: Yaru-blue [GTK2/3] \\nTerminal: tilix \\nCPU: 13th Gen Intel i7-1360P (16) @ 2.200GHz \\nGPU: Intel Device a7a0 \\nMemory: 4068MiB / 31800MiB \\n\")), mdx(\"h1\", {\n    \"id\": \"whats-in-the-box\",\n    \"style\": {\n      \"position\": \"relative\"\n    }\n  }, mdx(\"a\", {\n    parentName: \"h1\",\n    \"href\": \"#whats-in-the-box\",\n    \"aria-label\": \"whats in the box permalink\",\n    \"className\": \"anchor before\"\n  }, mdx(\"svg\", {\n    parentName: \"a\",\n    \"aria-hidden\": \"true\",\n    \"focusable\": \"false\",\n    \"height\": \"16\",\n    \"version\": \"1.1\",\n    \"viewBox\": \"0 0 16 16\",\n    \"width\": \"16\"\n  }, mdx(\"path\", {\n    parentName: \"svg\",\n    \"fillRule\": \"evenodd\",\n    \"d\": \"M4 9h1v1H4c-1.5 0-3-1.69-3-3.5S2.55 3 4 3h4c1.45 0 3 1.69 3 3.5 0 1.41-.91 2.72-2 3.25V8.59c.58-.45 1-1.27 1-2.09C10 5.22 8.98 4 8 4H4c-.98 0-2 1.22-2 2.5S3 9 4 9zm9-3h-1v1h1c1 0 2 1.22 2 2.5S13.98 12 13 12H9c-.98 0-2-1.22-2-2.5 0-.83.42-1.64 1-2.09V6.25c-1.09.53-2 1.84-2 3.25C6 11.31 7.55 13 9 13h4c1.45 0 3-1.69 3-3.5S14.5 6 13 6z\"\n  }))), \"What's in the box\"), mdx(\"p\", null, \"This is what I received for my pre-order. \"), mdx(\"p\", null, \"NOTE: Mine did not come with memory and storage modules because I already had some to spare.\"), mdx(\"ul\", null, mdx(\"li\", {\n    parentName: \"ul\"\n  }, \"Framework screwdriver\"), mdx(\"li\", {\n    parentName: \"ul\"\n  }, \"Input kit (keyboard, touchpad)\"), mdx(\"li\", {\n    parentName: \"ul\"\n  }, \"Display kit (display, bezel)\"), mdx(\"li\", {\n    parentName: \"ul\"\n  }, \"Main board\"), mdx(\"li\", {\n    parentName: \"ul\"\n  }, \"Special goodies (stickers, patch for being a pre-order)\"), mdx(\"li\", {\n    parentName: \"ul\"\n  }, \"4 expansion cards:\", mdx(\"ul\", {\n    parentName: \"li\"\n  }, mdx(\"li\", {\n    parentName: \"ul\"\n  }, \"2 x USB-C\"), mdx(\"li\", {\n    parentName: \"ul\"\n  }, \"1 x USB-A\"), mdx(\"li\", {\n    parentName: \"ul\"\n  }, \"1 x HDMI\")))), mdx(\"h1\", {\n    \"id\": \"what-i-already-had\",\n    \"style\": {\n      \"position\": \"relative\"\n    }\n  }, mdx(\"a\", {\n    parentName: \"h1\",\n    \"href\": \"#what-i-already-had\",\n    \"aria-label\": \"what i already had permalink\",\n    \"className\": \"anchor before\"\n  }, mdx(\"svg\", {\n    parentName: \"a\",\n    \"aria-hidden\": \"true\",\n    \"focusable\": \"false\",\n    \"height\": \"16\",\n    \"version\": \"1.1\",\n    \"viewBox\": \"0 0 16 16\",\n    \"width\": \"16\"\n  }, mdx(\"path\", {\n    parentName: \"svg\",\n    \"fillRule\": \"evenodd\",\n    \"d\": \"M4 9h1v1H4c-1.5 0-3-1.69-3-3.5S2.55 3 4 3h4c1.45 0 3 1.69 3 3.5 0 1.41-.91 2.72-2 3.25V8.59c.58-.45 1-1.27 1-2.09C10 5.22 8.98 4 8 4H4c-.98 0-2 1.22-2 2.5S3 9 4 9zm9-3h-1v1h1c1 0 2 1.22 2 2.5S13.98 12 13 12H9c-.98 0-2-1.22-2-2.5 0-.83.42-1.64 1-2.09V6.25c-1.09.53-2 1.84-2 3.25C6 11.31 7.55 13 9 13h4c1.45 0 3-1.69 3-3.5S14.5 6 13 6z\"\n  }))), \"What I already had\"), mdx(\"p\", null, \"I took these from my broken System76 addr ws 1 and installed them onto this machine.\"), mdx(\"ul\", null, mdx(\"li\", {\n    parentName: \"ul\"\n  }, \"1TB Samsung NVMe SSD\"), mdx(\"li\", {\n    parentName: \"ul\"\n  }, \"2 x 16GB DDR3 = 32GB\")), mdx(\"h1\", {\n    \"id\": \"assembly\",\n    \"style\": {\n      \"position\": \"relative\"\n    }\n  }, mdx(\"a\", {\n    parentName: \"h1\",\n    \"href\": \"#assembly\",\n    \"aria-label\": \"assembly permalink\",\n    \"className\": \"anchor before\"\n  }, mdx(\"svg\", {\n    parentName: \"a\",\n    \"aria-hidden\": \"true\",\n    \"focusable\": \"false\",\n    \"height\": \"16\",\n    \"version\": \"1.1\",\n    \"viewBox\": \"0 0 16 16\",\n    \"width\": \"16\"\n  }, mdx(\"path\", {\n    parentName: \"svg\",\n    \"fillRule\": \"evenodd\",\n    \"d\": \"M4 9h1v1H4c-1.5 0-3-1.69-3-3.5S2.55 3 4 3h4c1.45 0 3 1.69 3 3.5 0 1.41-.91 2.72-2 3.25V8.59c.58-.45 1-1.27 1-2.09C10 5.22 8.98 4 8 4H4c-.98 0-2 1.22-2 2.5S3 9 4 9zm9-3h-1v1h1c1 0 2 1.22 2 2.5S13.98 12 13 12H9c-.98 0-2-1.22-2-2.5 0-.83.42-1.64 1-2.09V6.25c-1.09.53-2 1.84-2 3.25C6 11.31 7.55 13 9 13h4c1.45 0 3-1.69 3-3.5S14.5 6 13 6z\"\n  }))), \"Assembly\"), mdx(\"p\", null, \"Used the official Framework \", mdx(\"a\", {\n    parentName: \"p\",\n    \"href\": \"https://guides.frame.work/Guide/Framework+Laptop+13+(13th+Gen+Intel+Core)+DIY+Edition+Quick+Start+Guide/168?lang=en\"\n  }, \"guide\"), \" for the DIY Edition.\"), mdx(\"p\", null, \"Make sure to connect the input kit cable to motherboard. I wondered for 15 minutes why the laptop wasn't powering on only to realize I hadn't actually connected the keyboard and touchpad to the motherboard. D'oh!\"), mdx(\"h1\", {\n    \"id\": \"operating-system\",\n    \"style\": {\n      \"position\": \"relative\"\n    }\n  }, mdx(\"a\", {\n    parentName: \"h1\",\n    \"href\": \"#operating-system\",\n    \"aria-label\": \"operating system permalink\",\n    \"className\": \"anchor before\"\n  }, mdx(\"svg\", {\n    parentName: \"a\",\n    \"aria-hidden\": \"true\",\n    \"focusable\": \"false\",\n    \"height\": \"16\",\n    \"version\": \"1.1\",\n    \"viewBox\": \"0 0 16 16\",\n    \"width\": \"16\"\n  }, mdx(\"path\", {\n    parentName: \"svg\",\n    \"fillRule\": \"evenodd\",\n    \"d\": \"M4 9h1v1H4c-1.5 0-3-1.69-3-3.5S2.55 3 4 3h4c1.45 0 3 1.69 3 3.5 0 1.41-.91 2.72-2 3.25V8.59c.58-.45 1-1.27 1-2.09C10 5.22 8.98 4 8 4H4c-.98 0-2 1.22-2 2.5S3 9 4 9zm9-3h-1v1h1c1 0 2 1.22 2 2.5S13.98 12 13 12H9c-.98 0-2-1.22-2-2.5 0-.83.42-1.64 1-2.09V6.25c-1.09.53-2 1.84-2 3.25C6 11.31 7.55 13 9 13h4c1.45 0 3-1.69 3-3.5S14.5 6 13 6z\"\n  }))), \"Operating System\"), mdx(\"p\", null, \"I installed Ubuntu 22.04 LTS using Framework's \", mdx(\"a\", {\n    parentName: \"p\",\n    \"href\": \"https://guides.frame.work/Guide/Ubuntu+22.04+LTS+Installation+on+the+Framework+Laptop+13/109\"\n  }, \"guide\"), \".\"));\n}\n;\nMDXContent.isMDXComponent = true;","inboundReferences":[],"frontmatter":{"title":"Framework Laptop 13","created":"2023-05-20T08:11","updated":"2023-05-20T08:11","tags":["garden","tech","gadget"],"stage":"seedling"},"tableOfContents":{"items":[{"url":"#system-information","title":"System Information"},{"url":"#whats-in-the-box","title":"What's in the box"},{"url":"#what-i-already-had","title":"What I already had"},{"url":"#assembly","title":"Assembly"},{"url":"#operating-system","title":"Operating System"}]}}},"pageContext":{"slug":"Framework-Laptop-13"}},
    "staticQueryHashes": []}