{
    "componentChunkName": "component---src-templates-note-template-js",
    "path": "/Using-Rust-in-Flutter-code",
    "result": {"data":{"mdx":{"body":"var _excluded = [\"components\"];\n\nfunction _extends() { _extends = Object.assign || function (target) { for (var i = 1; i < arguments.length; i++) { var source = arguments[i]; for (var key in source) { if (Object.prototype.hasOwnProperty.call(source, key)) { target[key] = source[key]; } } } return target; }; return _extends.apply(this, arguments); }\n\nfunction _objectWithoutProperties(source, excluded) { if (source == null) return {}; var target = _objectWithoutPropertiesLoose(source, excluded); var key, i; if (Object.getOwnPropertySymbols) { var sourceSymbolKeys = Object.getOwnPropertySymbols(source); for (i = 0; i < sourceSymbolKeys.length; i++) { key = sourceSymbolKeys[i]; if (excluded.indexOf(key) >= 0) continue; if (!Object.prototype.propertyIsEnumerable.call(source, key)) continue; target[key] = source[key]; } } return target; }\n\nfunction _objectWithoutPropertiesLoose(source, excluded) { if (source == null) return {}; var target = {}; var sourceKeys = Object.keys(source); var key, i; for (i = 0; i < sourceKeys.length; i++) { key = sourceKeys[i]; if (excluded.indexOf(key) >= 0) continue; target[key] = source[key]; } return target; }\n\n/* @jsxRuntime classic */\n\n/* @jsx mdx */\nvar _frontmatter = {\n  \"title\": \"Using Rust in Flutter code\",\n  \"created\": \"2022-03-06T14:15\",\n  \"updated\": \"2022-03-06T14:15\",\n  \"tags\": [\"how-to\", \"rust\", \"huggingface\"],\n  \"stage\": \"seedling\"\n};\nvar layoutProps = {\n  _frontmatter: _frontmatter\n};\nvar MDXLayout = \"wrapper\";\nreturn function MDXContent(_ref) {\n  var components = _ref.components,\n      props = _objectWithoutProperties(_ref, _excluded);\n\n  return mdx(MDXLayout, _extends({}, layoutProps, props, {\n    components: components,\n    mdxType: \"MDXLayout\"\n  }), mdx(\"h1\", {\n    \"id\": \"introduction\",\n    \"style\": {\n      \"position\": \"relative\"\n    }\n  }, mdx(\"a\", {\n    parentName: \"h1\",\n    \"href\": \"#introduction\",\n    \"aria-label\": \"introduction permalink\",\n    \"className\": \"anchor before\"\n  }, mdx(\"svg\", {\n    parentName: \"a\",\n    \"aria-hidden\": \"true\",\n    \"focusable\": \"false\",\n    \"height\": \"16\",\n    \"version\": \"1.1\",\n    \"viewBox\": \"0 0 16 16\",\n    \"width\": \"16\"\n  }, mdx(\"path\", {\n    parentName: \"svg\",\n    \"fillRule\": \"evenodd\",\n    \"d\": \"M4 9h1v1H4c-1.5 0-3-1.69-3-3.5S2.55 3 4 3h4c1.45 0 3 1.69 3 3.5 0 1.41-.91 2.72-2 3.25V8.59c.58-.45 1-1.27 1-2.09C10 5.22 8.98 4 8 4H4c-.98 0-2 1.22-2 2.5S3 9 4 9zm9-3h-1v1h1c1 0 2 1.22 2 2.5S13.98 12 13 12H9c-.98 0-2-1.22-2-2.5 0-.83.42-1.64 1-2.09V6.25c-1.09.53-2 1.84-2 3.25C6 11.31 7.55 13 9 13h4c1.45 0 3-1.69 3-3.5S14.5 6 13 6z\"\n  }))), \"Introduction\"), mdx(\"p\", null, \"I am trying to figure out how to integrate \", mdx(\"a\", {\n    parentName: \"p\",\n    \"href\": \"https://huggingface.co/\"\n  }, \"huggingface\"), \" into my Flutter app. Here is my attempt at figuring that out.\"), mdx(\"h1\", {\n    \"id\": \"setup\",\n    \"style\": {\n      \"position\": \"relative\"\n    }\n  }, mdx(\"a\", {\n    parentName: \"h1\",\n    \"href\": \"#setup\",\n    \"aria-label\": \"setup permalink\",\n    \"className\": \"anchor before\"\n  }, mdx(\"svg\", {\n    parentName: \"a\",\n    \"aria-hidden\": \"true\",\n    \"focusable\": \"false\",\n    \"height\": \"16\",\n    \"version\": \"1.1\",\n    \"viewBox\": \"0 0 16 16\",\n    \"width\": \"16\"\n  }, mdx(\"path\", {\n    parentName: \"svg\",\n    \"fillRule\": \"evenodd\",\n    \"d\": \"M4 9h1v1H4c-1.5 0-3-1.69-3-3.5S2.55 3 4 3h4c1.45 0 3 1.69 3 3.5 0 1.41-.91 2.72-2 3.25V8.59c.58-.45 1-1.27 1-2.09C10 5.22 8.98 4 8 4H4c-.98 0-2 1.22-2 2.5S3 9 4 9zm9-3h-1v1h1c1 0 2 1.22 2 2.5S13.98 12 13 12H9c-.98 0-2-1.22-2-2.5 0-.83.42-1.64 1-2.09V6.25c-1.09.53-2 1.84-2 3.25C6 11.31 7.55 13 9 13h4c1.45 0 3-1.69 3-3.5S14.5 6 13 6z\"\n  }))), \"Setup\"), mdx(\"h2\", {\n    \"id\": \"pre-requisites\",\n    \"style\": {\n      \"position\": \"relative\"\n    }\n  }, mdx(\"a\", {\n    parentName: \"h2\",\n    \"href\": \"#pre-requisites\",\n    \"aria-label\": \"pre requisites permalink\",\n    \"className\": \"anchor before\"\n  }, mdx(\"svg\", {\n    parentName: \"a\",\n    \"aria-hidden\": \"true\",\n    \"focusable\": \"false\",\n    \"height\": \"16\",\n    \"version\": \"1.1\",\n    \"viewBox\": \"0 0 16 16\",\n    \"width\": \"16\"\n  }, mdx(\"path\", {\n    parentName: \"svg\",\n    \"fillRule\": \"evenodd\",\n    \"d\": \"M4 9h1v1H4c-1.5 0-3-1.69-3-3.5S2.55 3 4 3h4c1.45 0 3 1.69 3 3.5 0 1.41-.91 2.72-2 3.25V8.59c.58-.45 1-1.27 1-2.09C10 5.22 8.98 4 8 4H4c-.98 0-2 1.22-2 2.5S3 9 4 9zm9-3h-1v1h1c1 0 2 1.22 2 2.5S13.98 12 13 12H9c-.98 0-2-1.22-2-2.5 0-.83.42-1.64 1-2.09V6.25c-1.09.53-2 1.84-2 3.25C6 11.31 7.55 13 9 13h4c1.45 0 3-1.69 3-3.5S14.5 6 13 6z\"\n  }))), \"Pre-requisites\"), mdx(\"pre\", null, mdx(\"code\", {\n    parentName: \"pre\",\n    \"className\": \"language-bash\"\n  }, \"curl --proto '=https' --tlsv1.2 -sSf https://sh.rustup.rs | sh\\n\\nsource $HOME/.cargo/env\\n\\nbrew install llvm\\n\\nrustup target add aarch64-apple-ios x86_64-apple-ios\\nrustup target add aarch64-apple-ios-sim\\n\")), mdx(\"h2\", {\n    \"id\": \"rust\",\n    \"style\": {\n      \"position\": \"relative\"\n    }\n  }, mdx(\"a\", {\n    parentName: \"h2\",\n    \"href\": \"#rust\",\n    \"aria-label\": \"rust permalink\",\n    \"className\": \"anchor before\"\n  }, mdx(\"svg\", {\n    parentName: \"a\",\n    \"aria-hidden\": \"true\",\n    \"focusable\": \"false\",\n    \"height\": \"16\",\n    \"version\": \"1.1\",\n    \"viewBox\": \"0 0 16 16\",\n    \"width\": \"16\"\n  }, mdx(\"path\", {\n    parentName: \"svg\",\n    \"fillRule\": \"evenodd\",\n    \"d\": \"M4 9h1v1H4c-1.5 0-3-1.69-3-3.5S2.55 3 4 3h4c1.45 0 3 1.69 3 3.5 0 1.41-.91 2.72-2 3.25V8.59c.58-.45 1-1.27 1-2.09C10 5.22 8.98 4 8 4H4c-.98 0-2 1.22-2 2.5S3 9 4 9zm9-3h-1v1h1c1 0 2 1.22 2 2.5S13.98 12 13 12H9c-.98 0-2-1.22-2-2.5 0-.83.42-1.64 1-2.09V6.25c-1.09.53-2 1.84-2 3.25C6 11.31 7.55 13 9 13h4c1.45 0 3-1.69 3-3.5S14.5 6 13 6z\"\n  }))), \"Rust\"), mdx(\"pre\", null, mdx(\"code\", {\n    parentName: \"pre\",\n    \"className\": \"language-bash\"\n  }, \"cargo install flutter_rust_bridge_codegen cbindgen\\ndart pub global activate ffigen\\n# if building for iOS or MacOS\\ncargo install cargo-xcode\\n\\nflutter pub add flutter_rust_bridge\\n# if using Dart codegen\\nflutter pub add -d build_runner\\nflutter pub add -d freezed\\nflutter pub add freezed_annotation\\n\")), mdx(\"h1\", {\n    \"id\": \"integrating-with-an-existing-project\",\n    \"style\": {\n      \"position\": \"relative\"\n    }\n  }, mdx(\"a\", {\n    parentName: \"h1\",\n    \"href\": \"#integrating-with-an-existing-project\",\n    \"aria-label\": \"integrating with an existing project permalink\",\n    \"className\": \"anchor before\"\n  }, mdx(\"svg\", {\n    parentName: \"a\",\n    \"aria-hidden\": \"true\",\n    \"focusable\": \"false\",\n    \"height\": \"16\",\n    \"version\": \"1.1\",\n    \"viewBox\": \"0 0 16 16\",\n    \"width\": \"16\"\n  }, mdx(\"path\", {\n    parentName: \"svg\",\n    \"fillRule\": \"evenodd\",\n    \"d\": \"M4 9h1v1H4c-1.5 0-3-1.69-3-3.5S2.55 3 4 3h4c1.45 0 3 1.69 3 3.5 0 1.41-.91 2.72-2 3.25V8.59c.58-.45 1-1.27 1-2.09C10 5.22 8.98 4 8 4H4c-.98 0-2 1.22-2 2.5S3 9 4 9zm9-3h-1v1h1c1 0 2 1.22 2 2.5S13.98 12 13 12H9c-.98 0-2-1.22-2-2.5 0-.83.42-1.64 1-2.09V6.25c-1.09.53-2 1.84-2 3.25C6 11.31 7.55 13 9 13h4c1.45 0 3-1.69 3-3.5S14.5 6 13 6z\"\n  }))), \"Integrating with an existing project\"), mdx(\"p\", null, \"Where \", mdx(\"inlineCode\", {\n    parentName: \"p\"\n  }, \"$crate\"), \" is the name of the crate. Set it by running \", mdx(\"inlineCode\", {\n    parentName: \"p\"\n  }, \"crate=somenamehere\")), mdx(\"pre\", null, mdx(\"code\", {\n    parentName: \"pre\",\n    \"className\": \"language-bash\"\n  }, \"crate=cortex\\n# At the root flutter project, create a crate\\ncargo new --lib $crate\\n\")), mdx(\"p\", null, \"Add this to \", mdx(\"inlineCode\", {\n    parentName: \"p\"\n  }, \"Cargo.toml\"), \":\"), mdx(\"pre\", null, mdx(\"code\", {\n    parentName: \"pre\",\n    \"className\": \"language-toml\"\n  }, \"[dependencies]\\nflutter_rust_bridge = \\\"1\\\"\\n\\n[lib]\\ncrate-type = [\\\"lib\\\", \\\"staticlib\\\", \\\"cdylib\\\"]\\n\")), mdx(\"p\", null, \"Then use \", mdx(\"inlineCode\", {\n    parentName: \"p\"\n  }, \"cargo\"), \" to generate an Xcode project within \", mdx(\"inlineCode\", {\n    parentName: \"p\"\n  }, \"$crate\"), \". You will add this as a sub-project for the \", mdx(\"inlineCode\", {\n    parentName: \"p\"\n  }, \"ios/Runner.xcodeproj\"), \".\"), mdx(\"pre\", null, mdx(\"code\", {\n    parentName: \"pre\",\n    \"className\": \"language-bash\"\n  }, \"cd $crate\\ncargo xcode\\n\")), mdx(\"h2\", {\n    \"id\": \"ios-setup\",\n    \"style\": {\n      \"position\": \"relative\"\n    }\n  }, mdx(\"a\", {\n    parentName: \"h2\",\n    \"href\": \"#ios-setup\",\n    \"aria-label\": \"ios setup permalink\",\n    \"className\": \"anchor before\"\n  }, mdx(\"svg\", {\n    parentName: \"a\",\n    \"aria-hidden\": \"true\",\n    \"focusable\": \"false\",\n    \"height\": \"16\",\n    \"version\": \"1.1\",\n    \"viewBox\": \"0 0 16 16\",\n    \"width\": \"16\"\n  }, mdx(\"path\", {\n    parentName: \"svg\",\n    \"fillRule\": \"evenodd\",\n    \"d\": \"M4 9h1v1H4c-1.5 0-3-1.69-3-3.5S2.55 3 4 3h4c1.45 0 3 1.69 3 3.5 0 1.41-.91 2.72-2 3.25V8.59c.58-.45 1-1.27 1-2.09C10 5.22 8.98 4 8 4H4c-.98 0-2 1.22-2 2.5S3 9 4 9zm9-3h-1v1h1c1 0 2 1.22 2 2.5S13.98 12 13 12H9c-.98 0-2-1.22-2-2.5 0-.83.42-1.64 1-2.09V6.25c-1.09.53-2 1.84-2 3.25C6 11.31 7.55 13 9 13h4c1.45 0 3-1.69 3-3.5S14.5 6 13 6z\"\n  }))), \"iOS setup\"), mdx(\"p\", null, mdx(\"inlineCode\", {\n    parentName: \"p\"\n  }, \"open ios/Runner.xcodeproj\")), mdx(\"p\", null, \"Then drag the \", mdx(\"inlineCode\", {\n    parentName: \"p\"\n  }, \"$crate/$crate.xcodeproj\"), \" under the \", mdx(\"inlineCode\", {\n    parentName: \"p\"\n  }, \"Runner\"), \" folder in the Xcode sidebar.\"), mdx(\"p\", null, \"Then click on the top \", mdx(\"inlineCode\", {\n    parentName: \"p\"\n  }, \"Runner\"), \" item in the sidebar -> Build Phases. \"), mdx(\"p\", null, \"Under Targets -> Runner -> Dependencies, add the \", mdx(\"inlineCode\", {\n    parentName: \"p\"\n  }, \"$crate-staticlib\"), \" . \"), mdx(\"p\", null, \"Under Link Binary With Libraries -> add \", mdx(\"inlineCode\", {\n    parentName: \"p\"\n  }, \"lib$crate_static.a\"), \".\"), mdx(\"p\", null, \"Then run:\"), mdx(\"pre\", null, mdx(\"code\", {\n    parentName: \"pre\",\n    \"className\": \"language-bash\"\n  }, \"flutter_rust_bridge_codegen \\\\\\n    -r $crate/src/api.rs \\\\\\n    -d lib/bridge_generated.dart \\\\\\n    -c ios/Runner/bridge_generated.h\\n# if building for MacOS\\ncp ios/Runner/bridge_generated.h macos/Runner/bridge_generated.h\\n\")), mdx(\"h1\", {\n    \"id\": \"libraries\",\n    \"style\": {\n      \"position\": \"relative\"\n    }\n  }, mdx(\"a\", {\n    parentName: \"h1\",\n    \"href\": \"#libraries\",\n    \"aria-label\": \"libraries permalink\",\n    \"className\": \"anchor before\"\n  }, mdx(\"svg\", {\n    parentName: \"a\",\n    \"aria-hidden\": \"true\",\n    \"focusable\": \"false\",\n    \"height\": \"16\",\n    \"version\": \"1.1\",\n    \"viewBox\": \"0 0 16 16\",\n    \"width\": \"16\"\n  }, mdx(\"path\", {\n    parentName: \"svg\",\n    \"fillRule\": \"evenodd\",\n    \"d\": \"M4 9h1v1H4c-1.5 0-3-1.69-3-3.5S2.55 3 4 3h4c1.45 0 3 1.69 3 3.5 0 1.41-.91 2.72-2 3.25V8.59c.58-.45 1-1.27 1-2.09C10 5.22 8.98 4 8 4H4c-.98 0-2 1.22-2 2.5S3 9 4 9zm9-3h-1v1h1c1 0 2 1.22 2 2.5S13.98 12 13 12H9c-.98 0-2-1.22-2-2.5 0-.83.42-1.64 1-2.09V6.25c-1.09.53-2 1.84-2 3.25C6 11.31 7.55 13 9 13h4c1.45 0 3-1.69 3-3.5S14.5 6 13 6z\"\n  }))), \"Libraries\"), mdx(\"ul\", null, mdx(\"li\", {\n    parentName: \"ul\"\n  }, mdx(\"a\", {\n    parentName: \"li\",\n    \"href\": \"https://github.com/shekohex/flutterust\"\n  }, \"flutterrust\")), mdx(\"li\", {\n    parentName: \"ul\"\n  }, mdx(\"a\", {\n    parentName: \"li\",\n    \"href\": \"https://pub.dev/packages/flutter_rust_bridge\"\n  }, \"flutter_rust_bridge\")), mdx(\"li\", {\n    parentName: \"ul\"\n  }, mdx(\"a\", {\n    parentName: \"li\",\n    \"href\": \"https://docs.rs/rust-bert/latest/rust_bert/\"\n  }, \"rust_bert\"))), mdx(\"h1\", {\n    \"id\": \"references\",\n    \"style\": {\n      \"position\": \"relative\"\n    }\n  }, mdx(\"a\", {\n    parentName: \"h1\",\n    \"href\": \"#references\",\n    \"aria-label\": \"references permalink\",\n    \"className\": \"anchor before\"\n  }, mdx(\"svg\", {\n    parentName: \"a\",\n    \"aria-hidden\": \"true\",\n    \"focusable\": \"false\",\n    \"height\": \"16\",\n    \"version\": \"1.1\",\n    \"viewBox\": \"0 0 16 16\",\n    \"width\": \"16\"\n  }, mdx(\"path\", {\n    parentName: \"svg\",\n    \"fillRule\": \"evenodd\",\n    \"d\": \"M4 9h1v1H4c-1.5 0-3-1.69-3-3.5S2.55 3 4 3h4c1.45 0 3 1.69 3 3.5 0 1.41-.91 2.72-2 3.25V8.59c.58-.45 1-1.27 1-2.09C10 5.22 8.98 4 8 4H4c-.98 0-2 1.22-2 2.5S3 9 4 9zm9-3h-1v1h1c1 0 2 1.22 2 2.5S13.98 12 13 12H9c-.98 0-2-1.22-2-2.5 0-.83.42-1.64 1-2.09V6.25c-1.09.53-2 1.84-2 3.25C6 11.31 7.55 13 9 13h4c1.45 0 3-1.69 3-3.5S14.5 6 13 6z\"\n  }))), \"References\"), mdx(\"ul\", null, mdx(\"li\", {\n    parentName: \"ul\"\n  }, mdx(\"a\", {\n    parentName: \"li\",\n    \"href\": \"https://medium.com/flutter-community/finally-running-rust-natively-on-a-flutter-plugin-here-is-how-6f2826eb1735\"\n  }, \"https://medium.com/flutter-community/finally-running-rust-natively-on-a-flutter-plugin-here-is-how-6f2826eb1735\")), mdx(\"li\", {\n    parentName: \"ul\"\n  }, mdx(\"a\", {\n    parentName: \"li\",\n    \"href\": \"https://fzyzcjy.github.io/flutter_rust_bridge/integrate.html\"\n  }, \"Integrate flutter_rust_bridge with existing project\"))));\n}\n;\nMDXContent.isMDXComponent = true;","inboundReferences":[],"frontmatter":{"title":"Using Rust in Flutter code","created":"2022-03-06T14:15","updated":"2022-03-06T14:15","tags":["how-to","rust","huggingface"],"stage":"seedling"},"tableOfContents":{"items":[{"url":"#introduction","title":"Introduction"},{"url":"#setup","title":"Setup","items":[{"url":"#pre-requisites","title":"Pre-requisites"},{"url":"#rust","title":"Rust"}]},{"url":"#integrating-with-an-existing-project","title":"Integrating with an existing project","items":[{"url":"#ios-setup","title":"iOS setup"}]},{"url":"#libraries","title":"Libraries"},{"url":"#references","title":"References"}]}}},"pageContext":{"slug":"Using-Rust-in-Flutter-code"}},
    "staticQueryHashes": []}