{
    "componentChunkName": "component---src-templates-note-template-js",
    "path": "/The-tyranny-of-timelines",
    "result": {"data":{"mdx":{"body":"var _excluded = [\"components\"];\n\nfunction _extends() { _extends = Object.assign || function (target) { for (var i = 1; i < arguments.length; i++) { var source = arguments[i]; for (var key in source) { if (Object.prototype.hasOwnProperty.call(source, key)) { target[key] = source[key]; } } } return target; }; return _extends.apply(this, arguments); }\n\nfunction _objectWithoutProperties(source, excluded) { if (source == null) return {}; var target = _objectWithoutPropertiesLoose(source, excluded); var key, i; if (Object.getOwnPropertySymbols) { var sourceSymbolKeys = Object.getOwnPropertySymbols(source); for (i = 0; i < sourceSymbolKeys.length; i++) { key = sourceSymbolKeys[i]; if (excluded.indexOf(key) >= 0) continue; if (!Object.prototype.propertyIsEnumerable.call(source, key)) continue; target[key] = source[key]; } } return target; }\n\nfunction _objectWithoutPropertiesLoose(source, excluded) { if (source == null) return {}; var target = {}; var sourceKeys = Object.keys(source); var key, i; for (i = 0; i < sourceKeys.length; i++) { key = sourceKeys[i]; if (excluded.indexOf(key) >= 0) continue; target[key] = source[key]; } return target; }\n\n/* @jsxRuntime classic */\n\n/* @jsx mdx */\nvar _frontmatter = {\n  \"title\": \"The tyranny of timelines\",\n  \"created\": \"2022-02-08T23:48\",\n  \"updated\": null,\n  \"tags\": [\"article\"],\n  \"stage\": \"budding\"\n};\nvar layoutProps = {\n  _frontmatter: _frontmatter\n};\nvar MDXLayout = \"wrapper\";\nreturn function MDXContent(_ref) {\n  var components = _ref.components,\n      props = _objectWithoutProperties(_ref, _excluded);\n\n  return mdx(MDXLayout, _extends({}, layoutProps, props, {\n    components: components,\n    mdxType: \"MDXLayout\"\n  }), mdx(\"p\", null, mdx(\"em\", {\n    parentName: \"p\"\n  }, \"In which I rant about my frustrations with the modern web and reminiscence on my early years developing for the web....\")), mdx(\"h1\", {\n    \"id\": \"the-angst-of-automation\",\n    \"style\": {\n      \"position\": \"relative\"\n    }\n  }, mdx(\"a\", {\n    parentName: \"h1\",\n    \"href\": \"#the-angst-of-automation\",\n    \"aria-label\": \"the angst of automation permalink\",\n    \"className\": \"anchor before\"\n  }, mdx(\"svg\", {\n    parentName: \"a\",\n    \"aria-hidden\": \"true\",\n    \"focusable\": \"false\",\n    \"height\": \"16\",\n    \"version\": \"1.1\",\n    \"viewBox\": \"0 0 16 16\",\n    \"width\": \"16\"\n  }, mdx(\"path\", {\n    parentName: \"svg\",\n    \"fillRule\": \"evenodd\",\n    \"d\": \"M4 9h1v1H4c-1.5 0-3-1.69-3-3.5S2.55 3 4 3h4c1.45 0 3 1.69 3 3.5 0 1.41-.91 2.72-2 3.25V8.59c.58-.45 1-1.27 1-2.09C10 5.22 8.98 4 8 4H4c-.98 0-2 1.22-2 2.5S3 9 4 9zm9-3h-1v1h1c1 0 2 1.22 2 2.5S13.98 12 13 12H9c-.98 0-2-1.22-2-2.5 0-.83.42-1.64 1-2.09V6.25c-1.09.53-2 1.84-2 3.25C6 11.31 7.55 13 9 13h4c1.45 0 3-1.69 3-3.5S14.5 6 13 6z\"\n  }))), \"The angst of automation\"), mdx(\"p\", null, \"Most of what you see today in social media is curated by a carefully-crafted algorithm and/or a statistical model that decides what to show you based on how you've engaged with the web.\"), mdx(\"p\", null, \"While there is nothing inherently wrong with this current model (and there is certainly a purpose for it, especially when there is a lot of information to sort and sift through), it can be alienating to engage with others on the web in a manner that, at least to me, feels utterly inauthentic. The personas we present on social media are often \\\"optimized\\\" to be marketable even if we're not selling anything. This is by design because our personal information, our usage habits, our preferences comprise the real currency of digital media: our data.\"), mdx(\"p\", null, \"Hidden in those Terms of Service agreements most people tend to disregard (because of how opaque the language in them is) are conditions that allow these platforms to use your data in some questionable ways, even \", mdx(\"a\", {\n    parentName: \"p\",\n    \"href\": \"https://www.theverge.com/2022/1/31/22906979/crisis-text-line-loris-ai-epic-privacy-mental-health\"\n  }, \"not-for-profit services like the Crisis Text Line\"), \" who claim to scrub Personally Identifiable Information (PII) from your data when they sell it off to a third-party.\"), mdx(\"p\", null, \"Sure, it may be notoriously difficult to obtain sufficiently large (whatever that means) bodies of data for Natural Language Processing pipelines, but to use data from vulnerable populations, from people who are already struggling to find a confidante in their own lives, betrays a level of trust far beyond what these services and platforms can even hope to regain.\"), mdx(\"h1\", {\n    \"id\": \"feeds-of-frustration\",\n    \"style\": {\n      \"position\": \"relative\"\n    }\n  }, mdx(\"a\", {\n    parentName: \"h1\",\n    \"href\": \"#feeds-of-frustration\",\n    \"aria-label\": \"feeds of frustration permalink\",\n    \"className\": \"anchor before\"\n  }, mdx(\"svg\", {\n    parentName: \"a\",\n    \"aria-hidden\": \"true\",\n    \"focusable\": \"false\",\n    \"height\": \"16\",\n    \"version\": \"1.1\",\n    \"viewBox\": \"0 0 16 16\",\n    \"width\": \"16\"\n  }, mdx(\"path\", {\n    parentName: \"svg\",\n    \"fillRule\": \"evenodd\",\n    \"d\": \"M4 9h1v1H4c-1.5 0-3-1.69-3-3.5S2.55 3 4 3h4c1.45 0 3 1.69 3 3.5 0 1.41-.91 2.72-2 3.25V8.59c.58-.45 1-1.27 1-2.09C10 5.22 8.98 4 8 4H4c-.98 0-2 1.22-2 2.5S3 9 4 9zm9-3h-1v1h1c1 0 2 1.22 2 2.5S13.98 12 13 12H9c-.98 0-2-1.22-2-2.5 0-.83.42-1.64 1-2.09V6.25c-1.09.53-2 1.84-2 3.25C6 11.31 7.55 13 9 13h4c1.45 0 3-1.69 3-3.5S14.5 6 13 6z\"\n  }))), \"Feeds of frustration\"), mdx(\"p\", null, \"The predominance and prevalence of feed-based social media, powered by these algorithmic curations, has seeped into what previously were personal sites with a lot of personality.\"), mdx(\"p\", null, \"Nowadays, we see a lot of the same formats, the same, cookie-cutter WordPress/Ghost/Medium blogs where it's hard to stand out as a creator, Facebook and Twitter feeds\"), mdx(\"p\", null, \"With algorithmically-curated feeds, we're exposed to information that may be popular and highly engaging but inaccurate or lack sufficient information.\"), mdx(\"p\", null, \"(And also, must everything be SEO-optimized even if I'm just running a personal site about heirloom tomatoes or something??)\"), mdx(\"p\", null, \"We traded convenience at the cost of character, exchanged the personal for the profitable.\"), mdx(\"p\", null, mdx(\"strong\", {\n    parentName: \"p\"\n  }, \"But you know, it wasn't always this way.\")), mdx(\"h1\", {\n    \"id\": \"in-the-beginning-was\",\n    \"style\": {\n      \"position\": \"relative\"\n    }\n  }, mdx(\"a\", {\n    parentName: \"h1\",\n    \"href\": \"#in-the-beginning-was\",\n    \"aria-label\": \"in the beginning was permalink\",\n    \"className\": \"anchor before\"\n  }, mdx(\"svg\", {\n    parentName: \"a\",\n    \"aria-hidden\": \"true\",\n    \"focusable\": \"false\",\n    \"height\": \"16\",\n    \"version\": \"1.1\",\n    \"viewBox\": \"0 0 16 16\",\n    \"width\": \"16\"\n  }, mdx(\"path\", {\n    parentName: \"svg\",\n    \"fillRule\": \"evenodd\",\n    \"d\": \"M4 9h1v1H4c-1.5 0-3-1.69-3-3.5S2.55 3 4 3h4c1.45 0 3 1.69 3 3.5 0 1.41-.91 2.72-2 3.25V8.59c.58-.45 1-1.27 1-2.09C10 5.22 8.98 4 8 4H4c-.98 0-2 1.22-2 2.5S3 9 4 9zm9-3h-1v1h1c1 0 2 1.22 2 2.5S13.98 12 13 12H9c-.98 0-2-1.22-2-2.5 0-.83.42-1.64 1-2.09V6.25c-1.09.53-2 1.84-2 3.25C6 11.31 7.55 13 9 13h4c1.45 0 3-1.69 3-3.5S14.5 6 13 6z\"\n  }))), \"In the beginning was...\"), mdx(\"p\", null, \"(c. early-to-mid 2000s)\"), mdx(\"h2\", {\n    \"id\": \"the-cyberpartment\",\n    \"style\": {\n      \"position\": \"relative\"\n    }\n  }, mdx(\"a\", {\n    parentName: \"h2\",\n    \"href\": \"#the-cyberpartment\",\n    \"aria-label\": \"the cyberpartment permalink\",\n    \"className\": \"anchor before\"\n  }, mdx(\"svg\", {\n    parentName: \"a\",\n    \"aria-hidden\": \"true\",\n    \"focusable\": \"false\",\n    \"height\": \"16\",\n    \"version\": \"1.1\",\n    \"viewBox\": \"0 0 16 16\",\n    \"width\": \"16\"\n  }, mdx(\"path\", {\n    parentName: \"svg\",\n    \"fillRule\": \"evenodd\",\n    \"d\": \"M4 9h1v1H4c-1.5 0-3-1.69-3-3.5S2.55 3 4 3h4c1.45 0 3 1.69 3 3.5 0 1.41-.91 2.72-2 3.25V8.59c.58-.45 1-1.27 1-2.09C10 5.22 8.98 4 8 4H4c-.98 0-2 1.22-2 2.5S3 9 4 9zm9-3h-1v1h1c1 0 2 1.22 2 2.5S13.98 12 13 12H9c-.98 0-2-1.22-2-2.5 0-.83.42-1.64 1-2.09V6.25c-1.09.53-2 1.84-2 3.25C6 11.31 7.55 13 9 13h4c1.45 0 3-1.69 3-3.5S14.5 6 13 6z\"\n  }))), \"The cyberpartment\"), mdx(\"p\", null, \"The first website I ever built was a virtual apartment, or \", mdx(\"em\", {\n    parentName: \"p\"\n  }, \"cyberpartment\"), \" as I termed it, that I showed off to a handful of my (2) friends. None of this involved JavaScript, of course, because I either hadn't learned it yet or it was unable to achieve what I wanted it to do (Both?). It's been 18 years, so the details of this endeavour are vague, but in essence my little cyberpartment was a collection of HTML pages linked to each other in some manner. Each page was a different room in the virtual apartment, and to enter one, you simply click on a graphic of a door.\"), mdx(\"p\", null, \"On the home page, visitors would be greeted by the image of a door I had clearly made in MS Paint. Clicking on that \\\"opened\\\" the \\\"apartment\\\", or to put it in a much more banal way, brought you to the next page I'd coded up. There was even a window in one of these \\\"rooms\\\". What I put in these \\\"rooms\\\" I can unfortunately no longer remember, but perhaps that is to everyone's benefit (to be spared of my cringiest years).\"), mdx(\"p\", null, \"I was particularly proud of this very basic website because it was being hosted on a web server I set up on our shared family PC running Windows. I configured \", mdx(\"a\", {\n    parentName: \"p\",\n    \"href\": \"http://www.keyfocus.net/kfws/\"\n  }, \"KF Web Server\"), \" to serve the pages up to the public because I was 12 or 13 and blissfully unaware of security practices...and I was also probably running afoul of our ISP's terms of service by running a web server.\"), mdx(\"p\", null, \"But none of that mattered to me because I had a web presence at last, and one that impressed my (2) friends.\"), mdx(\"h2\", {\n    \"id\": \"the-great-white-way-on-the-web\",\n    \"style\": {\n      \"position\": \"relative\"\n    }\n  }, mdx(\"a\", {\n    parentName: \"h2\",\n    \"href\": \"#the-great-white-way-on-the-web\",\n    \"aria-label\": \"the great white way on the web permalink\",\n    \"className\": \"anchor before\"\n  }, mdx(\"svg\", {\n    parentName: \"a\",\n    \"aria-hidden\": \"true\",\n    \"focusable\": \"false\",\n    \"height\": \"16\",\n    \"version\": \"1.1\",\n    \"viewBox\": \"0 0 16 16\",\n    \"width\": \"16\"\n  }, mdx(\"path\", {\n    parentName: \"svg\",\n    \"fillRule\": \"evenodd\",\n    \"d\": \"M4 9h1v1H4c-1.5 0-3-1.69-3-3.5S2.55 3 4 3h4c1.45 0 3 1.69 3 3.5 0 1.41-.91 2.72-2 3.25V8.59c.58-.45 1-1.27 1-2.09C10 5.22 8.98 4 8 4H4c-.98 0-2 1.22-2 2.5S3 9 4 9zm9-3h-1v1h1c1 0 2 1.22 2 2.5S13.98 12 13 12H9c-.98 0-2-1.22-2-2.5 0-.83.42-1.64 1-2.09V6.25c-1.09.53-2 1.84-2 3.25C6 11.31 7.55 13 9 13h4c1.45 0 3-1.69 3-3.5S14.5 6 13 6z\"\n  }))), \"The Great White Way on the Web\"), mdx(\"p\", null, \"Soon after I explored the world of other HTTP servers (Apache, which intimidated me, Microsoft Personal Web Server, which seemed a lot easier to use I suppose), the conveniences of WYSIWYG web page editors, and the quirky character of Geocities pages, I became enamored with musical theatre and all things Broadway/Off-Broadway/West End/Off-West End (I was far too pretentious at the time to acknowledge that regional and community theatre can be just as incredible).\"), mdx(\"p\", null, \"My closest friends in meatspace (I made some new ones after transferring to a new school) for the most part did not appreciate the art of musical theatre, so I turned to online communities that lived in PHP-based forums to find my niche of people. I was pleased to find many (at least 5) other people who shared my passion for Sondheim, Wicked, Les Miserables, The Drowsy Chaperone...(this list is by no means comprehensive as I was \", mdx(\"em\", {\n    parentName: \"p\"\n  }, \"very\"), \" obsessed with musical theatre).\"), mdx(\"p\", null, \"Like many fans, I had even entertained the possibility of becoming an actor in musical theatre but soon learned that such a career required much patience, discipline, survival on very little money, hours upon hours of practice, \", mdx(\"em\", {\n    parentName: \"p\"\n  }, \"actual\"), \" acting and singing ability (as it turns out, starring in a middle school production of a famous musical did not quite capture the challenges of that career).\"), mdx(\"p\", null, \"So instead I turned to building fansites for musical theatre actors as \", mdx(\"em\", {\n    parentName: \"p\"\n  }, \"my\"), \" creative outlet. All that energy I would have expended on singing lessons I channeled into this mix of the creative and the technical. I worked with my online friends (all of whom were teenagers at the time as well) who were more versed in graphic design to put together a unique, colorful, and oftentimes whimsical expression of love for musical theatre.\"), mdx(\"h1\", {\n    \"id\": \"the-present-day\",\n    \"style\": {\n      \"position\": \"relative\"\n    }\n  }, mdx(\"a\", {\n    parentName: \"h1\",\n    \"href\": \"#the-present-day\",\n    \"aria-label\": \"the present day permalink\",\n    \"className\": \"anchor before\"\n  }, mdx(\"svg\", {\n    parentName: \"a\",\n    \"aria-hidden\": \"true\",\n    \"focusable\": \"false\",\n    \"height\": \"16\",\n    \"version\": \"1.1\",\n    \"viewBox\": \"0 0 16 16\",\n    \"width\": \"16\"\n  }, mdx(\"path\", {\n    parentName: \"svg\",\n    \"fillRule\": \"evenodd\",\n    \"d\": \"M4 9h1v1H4c-1.5 0-3-1.69-3-3.5S2.55 3 4 3h4c1.45 0 3 1.69 3 3.5 0 1.41-.91 2.72-2 3.25V8.59c.58-.45 1-1.27 1-2.09C10 5.22 8.98 4 8 4H4c-.98 0-2 1.22-2 2.5S3 9 4 9zm9-3h-1v1h1c1 0 2 1.22 2 2.5S13.98 12 13 12H9c-.98 0-2-1.22-2-2.5 0-.83.42-1.64 1-2.09V6.25c-1.09.53-2 1.84-2 3.25C6 11.31 7.55 13 9 13h4c1.45 0 3-1.69 3-3.5S14.5 6 13 6z\"\n  }))), \"The present day\"), mdx(\"p\", null, \"As a sort of rebellion, if you can call it that, against the tyranny of timelines and bubble feeds, I built this \", mdx(\"a\", {\n    parentName: \"p\",\n    \"href\": \"/Digital-Garden\",\n    \"title\": \"Digital Garden\"\n  }, \"Digital Garden\"), \" as a way to present my ideas in a format that I don't find nearly as constricting as a blog, like the one I had \", mdx(\"a\", {\n    parentName: \"p\",\n    \"href\": \"https://allysonjulian.com\"\n  }, \"here\"), \". This site, while not quite as organized as my beautifully-made, MS Paint graphic-decorated 2003/4-era cyberpartment, is a better reflection of my brain than anything I've ever built as a personal site. I tried the whole static site blog thing after I grew weary of WordPress and Ghost (which are both excellent, just not my cup of tea) and found that I seldom updated it (it's been 6 years since I updated that blog).\"), mdx(\"p\", null, \"There's something liberating about this format that's not bounded by timelines, chronology. The data I have here is not linear and not static (although the site itself is static). I can continually update this page if I wanted to (and I probably will).\"), mdx(\"h1\", {\n    \"id\": \"some-other-notes\",\n    \"style\": {\n      \"position\": \"relative\"\n    }\n  }, mdx(\"a\", {\n    parentName: \"h1\",\n    \"href\": \"#some-other-notes\",\n    \"aria-label\": \"some other notes permalink\",\n    \"className\": \"anchor before\"\n  }, mdx(\"svg\", {\n    parentName: \"a\",\n    \"aria-hidden\": \"true\",\n    \"focusable\": \"false\",\n    \"height\": \"16\",\n    \"version\": \"1.1\",\n    \"viewBox\": \"0 0 16 16\",\n    \"width\": \"16\"\n  }, mdx(\"path\", {\n    parentName: \"svg\",\n    \"fillRule\": \"evenodd\",\n    \"d\": \"M4 9h1v1H4c-1.5 0-3-1.69-3-3.5S2.55 3 4 3h4c1.45 0 3 1.69 3 3.5 0 1.41-.91 2.72-2 3.25V8.59c.58-.45 1-1.27 1-2.09C10 5.22 8.98 4 8 4H4c-.98 0-2 1.22-2 2.5S3 9 4 9zm9-3h-1v1h1c1 0 2 1.22 2 2.5S13.98 12 13 12H9c-.98 0-2-1.22-2-2.5 0-.83.42-1.64 1-2.09V6.25c-1.09.53-2 1.84-2 3.25C6 11.31 7.55 13 9 13h4c1.45 0 3-1.69 3-3.5S14.5 6 13 6z\"\n  }))), \"Some other notes...\"), mdx(\"p\", null, \"Yes, there is an abundance of alliteration here, but that wasn't intentional, I swear!\"));\n}\n;\nMDXContent.isMDXComponent = true;","inboundReferences":[],"frontmatter":{"title":"The tyranny of timelines","created":"2022-02-08T23:48","updated":null,"tags":["article"],"stage":"budding"},"tableOfContents":{"items":[{"url":"#the-angst-of-automation","title":"The angst of automation"},{"url":"#feeds-of-frustration","title":"Feeds of frustration"},{"url":"#in-the-beginning-was","title":"In the beginning was...","items":[{"url":"#the-cyberpartment","title":"The cyberpartment"},{"url":"#the-great-white-way-on-the-web","title":"The Great White Way on the Web"}]},{"url":"#the-present-day","title":"The present day"},{"url":"#some-other-notes","title":"Some other notes..."}]}}},"pageContext":{"slug":"The-tyranny-of-timelines"}},
    "staticQueryHashes": []}