{
    "componentChunkName": "component---src-templates-note-template-js",
    "path": "/Flutter",
    "result": {"data":{"mdx":{"body":"var _excluded = [\"components\"];\n\nfunction _extends() { _extends = Object.assign || function (target) { for (var i = 1; i < arguments.length; i++) { var source = arguments[i]; for (var key in source) { if (Object.prototype.hasOwnProperty.call(source, key)) { target[key] = source[key]; } } } return target; }; return _extends.apply(this, arguments); }\n\nfunction _objectWithoutProperties(source, excluded) { if (source == null) return {}; var target = _objectWithoutPropertiesLoose(source, excluded); var key, i; if (Object.getOwnPropertySymbols) { var sourceSymbolKeys = Object.getOwnPropertySymbols(source); for (i = 0; i < sourceSymbolKeys.length; i++) { key = sourceSymbolKeys[i]; if (excluded.indexOf(key) >= 0) continue; if (!Object.prototype.propertyIsEnumerable.call(source, key)) continue; target[key] = source[key]; } } return target; }\n\nfunction _objectWithoutPropertiesLoose(source, excluded) { if (source == null) return {}; var target = {}; var sourceKeys = Object.keys(source); var key, i; for (i = 0; i < sourceKeys.length; i++) { key = sourceKeys[i]; if (excluded.indexOf(key) >= 0) continue; target[key] = source[key]; } return target; }\n\n/* @jsxRuntime classic */\n\n/* @jsx mdx */\nvar _frontmatter = {\n  \"title\": \"Flutter\",\n  \"created\": \"2023-01-30T00:29\",\n  \"updated\": \"2023-01-30T00:29\",\n  \"tags\": [\"garden\", \"how-to\", \"flutter\"],\n  \"stage\": \"seedling\"\n};\nvar layoutProps = {\n  _frontmatter: _frontmatter\n};\nvar MDXLayout = \"wrapper\";\nreturn function MDXContent(_ref) {\n  var components = _ref.components,\n      props = _objectWithoutProperties(_ref, _excluded);\n\n  return mdx(MDXLayout, _extends({}, layoutProps, props, {\n    components: components,\n    mdxType: \"MDXLayout\"\n  }), mdx(\"blockquote\", null, mdx(\"p\", {\n    parentName: \"blockquote\"\n  }, mdx(\"a\", {\n    parentName: \"p\",\n    \"href\": \"https://flutter.dev/\"\n  }, \"Flutter\"), \"  is an open source framework by Google for building beautiful, natively compiled, multi-platform applications from a single codebase.\")), mdx(\"p\", null, \"I use Flutter for building many of the apps I develop for mobile and desktop. Like other software ecosystems, my projects require different \", mdx(\"inlineCode\", {\n    parentName: \"p\"\n  }, \"flutter\"), \"  versions, so I use \", mdx(\"a\", {\n    parentName: \"p\",\n    \"href\": \"https://fvm.app/\"\n  }, \"fvm\"), \" for managing versions.\"), mdx(\"p\", null, \"This guide will show you how to install the Flutter SDK that will act as the default version of \", mdx(\"inlineCode\", {\n    parentName: \"p\"\n  }, \"flutter\"), \" and how to setup \", mdx(\"inlineCode\", {\n    parentName: \"p\"\n  }, \"fvm\"), \".\"), mdx(\"h1\", {\n    \"id\": \"setup-the-main-flutter-sdk\",\n    \"style\": {\n      \"position\": \"relative\"\n    }\n  }, mdx(\"a\", {\n    parentName: \"h1\",\n    \"href\": \"#setup-the-main-flutter-sdk\",\n    \"aria-label\": \"setup the main flutter sdk permalink\",\n    \"className\": \"anchor before\"\n  }, mdx(\"svg\", {\n    parentName: \"a\",\n    \"aria-hidden\": \"true\",\n    \"focusable\": \"false\",\n    \"height\": \"16\",\n    \"version\": \"1.1\",\n    \"viewBox\": \"0 0 16 16\",\n    \"width\": \"16\"\n  }, mdx(\"path\", {\n    parentName: \"svg\",\n    \"fillRule\": \"evenodd\",\n    \"d\": \"M4 9h1v1H4c-1.5 0-3-1.69-3-3.5S2.55 3 4 3h4c1.45 0 3 1.69 3 3.5 0 1.41-.91 2.72-2 3.25V8.59c.58-.45 1-1.27 1-2.09C10 5.22 8.98 4 8 4H4c-.98 0-2 1.22-2 2.5S3 9 4 9zm9-3h-1v1h1c1 0 2 1.22 2 2.5S13.98 12 13 12H9c-.98 0-2-1.22-2-2.5 0-.83.42-1.64 1-2.09V6.25c-1.09.53-2 1.84-2 3.25C6 11.31 7.55 13 9 13h4c1.45 0 3-1.69 3-3.5S14.5 6 13 6z\"\n  }))), \"Setup the main Flutter SDK\"), mdx(\"h2\", {\n    \"id\": \"install-on-pop_os-linux\",\n    \"style\": {\n      \"position\": \"relative\"\n    }\n  }, mdx(\"a\", {\n    parentName: \"h2\",\n    \"href\": \"#install-on-pop_os-linux\",\n    \"aria-label\": \"install on pop_os linux permalink\",\n    \"className\": \"anchor before\"\n  }, mdx(\"svg\", {\n    parentName: \"a\",\n    \"aria-hidden\": \"true\",\n    \"focusable\": \"false\",\n    \"height\": \"16\",\n    \"version\": \"1.1\",\n    \"viewBox\": \"0 0 16 16\",\n    \"width\": \"16\"\n  }, mdx(\"path\", {\n    parentName: \"svg\",\n    \"fillRule\": \"evenodd\",\n    \"d\": \"M4 9h1v1H4c-1.5 0-3-1.69-3-3.5S2.55 3 4 3h4c1.45 0 3 1.69 3 3.5 0 1.41-.91 2.72-2 3.25V8.59c.58-.45 1-1.27 1-2.09C10 5.22 8.98 4 8 4H4c-.98 0-2 1.22-2 2.5S3 9 4 9zm9-3h-1v1h1c1 0 2 1.22 2 2.5S13.98 12 13 12H9c-.98 0-2-1.22-2-2.5 0-.83.42-1.64 1-2.09V6.25c-1.09.53-2 1.84-2 3.25C6 11.31 7.55 13 9 13h4c1.45 0 3-1.69 3-3.5S14.5 6 13 6z\"\n  }))), \"Install on \", mdx(\"inlineCode\", {\n    parentName: \"h2\"\n  }, \"Pop!_OS\"), \" (Linux)\"), mdx(\"p\", null, \"According to \", mdx(\"a\", {\n    parentName: \"p\",\n    \"href\": \"https://github.com/flutter/flutter/issues/115909\"\n  }, \"this\"), \" GitHub issue on the Flutter repo, there is currently a problem with the Flutter SDK and \", mdx(\"inlineCode\", {\n    parentName: \"p\"\n  }, \"Pop!_OS\"), \". As a workaround, install these dependencies:\"), mdx(\"pre\", null, mdx(\"code\", {\n    parentName: \"pre\",\n    \"className\": \"language-shell\"\n  }, \"sudo apt-get install clang cmake ninja-build pkg-config libgtk-3-dev liblzma-dev libstdc++-12-dev\\n\")), mdx(\"p\", null, \"Then install the SDK locally:\"), mdx(\"pre\", null, mdx(\"code\", {\n    parentName: \"pre\",\n    \"className\": \"language-shell\"\n  }, \"# Prepare directory\\nmkdir -p ~/.local/share\\ncd ~/.local/share\\n\\n# Checkout the stable branch\\ngit clone https://github.com/flutter/flutter.git -b stable\\n\")), mdx(\"p\", null, \"Edit your \", mdx(\"inlineCode\", {\n    parentName: \"p\"\n  }, \"PATH\"), \" to include \", mdx(\"inlineCode\", {\n    parentName: \"p\"\n  }, \"$HOME/.local/share/flutter/bin\"), \". For example, if you use \", mdx(\"inlineCode\", {\n    parentName: \"p\"\n  }, \"zsh\"), \":\"), mdx(\"pre\", null, mdx(\"code\", {\n    parentName: \"pre\",\n    \"className\": \"language-shell\"\n  }, \"export PATH=$HOME/bin:$HOME/.local/share/flutter/bin:$HOME/.local/bin:$PATH\\n\")), mdx(\"p\", null, \"Then restart your terminal.\"), mdx(\"h1\", {\n    \"id\": \"setup-fvm-macos-and-linux\",\n    \"style\": {\n      \"position\": \"relative\"\n    }\n  }, mdx(\"a\", {\n    parentName: \"h1\",\n    \"href\": \"#setup-fvm-macos-and-linux\",\n    \"aria-label\": \"setup fvm macos and linux permalink\",\n    \"className\": \"anchor before\"\n  }, mdx(\"svg\", {\n    parentName: \"a\",\n    \"aria-hidden\": \"true\",\n    \"focusable\": \"false\",\n    \"height\": \"16\",\n    \"version\": \"1.1\",\n    \"viewBox\": \"0 0 16 16\",\n    \"width\": \"16\"\n  }, mdx(\"path\", {\n    parentName: \"svg\",\n    \"fillRule\": \"evenodd\",\n    \"d\": \"M4 9h1v1H4c-1.5 0-3-1.69-3-3.5S2.55 3 4 3h4c1.45 0 3 1.69 3 3.5 0 1.41-.91 2.72-2 3.25V8.59c.58-.45 1-1.27 1-2.09C10 5.22 8.98 4 8 4H4c-.98 0-2 1.22-2 2.5S3 9 4 9zm9-3h-1v1h1c1 0 2 1.22 2 2.5S13.98 12 13 12H9c-.98 0-2-1.22-2-2.5 0-.83.42-1.64 1-2.09V6.25c-1.09.53-2 1.84-2 3.25C6 11.31 7.55 13 9 13h4c1.45 0 3-1.69 3-3.5S14.5 6 13 6z\"\n  }))), \"Setup fvm (macOS and Linux)\"), mdx(\"p\", null, \"If you don't already have \", mdx(\"a\", {\n    parentName: \"p\",\n    \"href\": \"https://brew.sh\"\n  }, \"brew\"), \" installed, install it suing this command:\"), mdx(\"pre\", null, mdx(\"code\", {\n    parentName: \"pre\",\n    \"className\": \"language-shell\"\n  }, \"/bin/bash -c \\\"$(curl -fsSL https://raw.githubusercontent.com/Homebrew/install/HEAD/install.sh)\\\"\\n\")), mdx(\"p\", null, \"Then, install \", mdx(\"inlineCode\", {\n    parentName: \"p\"\n  }, \"fvm\"), \" with:\"), mdx(\"pre\", null, mdx(\"code\", {\n    parentName: \"pre\",\n    \"className\": \"language-shell\"\n  }, \"brew tap leoafarias/fvm\\nbrew install fvm\\n\")), mdx(\"h1\", {\n    \"id\": \"ideeditor-configuration\",\n    \"style\": {\n      \"position\": \"relative\"\n    }\n  }, mdx(\"a\", {\n    parentName: \"h1\",\n    \"href\": \"#ideeditor-configuration\",\n    \"aria-label\": \"ideeditor configuration permalink\",\n    \"className\": \"anchor before\"\n  }, mdx(\"svg\", {\n    parentName: \"a\",\n    \"aria-hidden\": \"true\",\n    \"focusable\": \"false\",\n    \"height\": \"16\",\n    \"version\": \"1.1\",\n    \"viewBox\": \"0 0 16 16\",\n    \"width\": \"16\"\n  }, mdx(\"path\", {\n    parentName: \"svg\",\n    \"fillRule\": \"evenodd\",\n    \"d\": \"M4 9h1v1H4c-1.5 0-3-1.69-3-3.5S2.55 3 4 3h4c1.45 0 3 1.69 3 3.5 0 1.41-.91 2.72-2 3.25V8.59c.58-.45 1-1.27 1-2.09C10 5.22 8.98 4 8 4H4c-.98 0-2 1.22-2 2.5S3 9 4 9zm9-3h-1v1h1c1 0 2 1.22 2 2.5S13.98 12 13 12H9c-.98 0-2-1.22-2-2.5 0-.83.42-1.64 1-2.09V6.25c-1.09.53-2 1.84-2 3.25C6 11.31 7.55 13 9 13h4c1.45 0 3-1.69 3-3.5S14.5 6 13 6z\"\n  }))), \"IDE/Editor Configuration\"), mdx(\"h2\", {\n    \"id\": \"vs-code\",\n    \"style\": {\n      \"position\": \"relative\"\n    }\n  }, mdx(\"a\", {\n    parentName: \"h2\",\n    \"href\": \"#vs-code\",\n    \"aria-label\": \"vs code permalink\",\n    \"className\": \"anchor before\"\n  }, mdx(\"svg\", {\n    parentName: \"a\",\n    \"aria-hidden\": \"true\",\n    \"focusable\": \"false\",\n    \"height\": \"16\",\n    \"version\": \"1.1\",\n    \"viewBox\": \"0 0 16 16\",\n    \"width\": \"16\"\n  }, mdx(\"path\", {\n    parentName: \"svg\",\n    \"fillRule\": \"evenodd\",\n    \"d\": \"M4 9h1v1H4c-1.5 0-3-1.69-3-3.5S2.55 3 4 3h4c1.45 0 3 1.69 3 3.5 0 1.41-.91 2.72-2 3.25V8.59c.58-.45 1-1.27 1-2.09C10 5.22 8.98 4 8 4H4c-.98 0-2 1.22-2 2.5S3 9 4 9zm9-3h-1v1h1c1 0 2 1.22 2 2.5S13.98 12 13 12H9c-.98 0-2-1.22-2-2.5 0-.83.42-1.64 1-2.09V6.25c-1.09.53-2 1.84-2 3.25C6 11.31 7.55 13 9 13h4c1.45 0 3-1.69 3-3.5S14.5 6 13 6z\"\n  }))), \"VS Code\"), mdx(\"p\", null, \"Create \", mdx(\"inlineCode\", {\n    parentName: \"p\"\n  }, \".vscode\"), \" folder inside your project's folder. \"), mdx(\"p\", null, \"Then, create or edit a \", mdx(\"inlineCode\", {\n    parentName: \"p\"\n  }, \".vscode/settings.json\"), \" file and add these:\"), mdx(\"pre\", null, mdx(\"code\", {\n    parentName: \"pre\",\n    \"className\": \"language-json\"\n  }, \"{\\n  \\\"dart.flutterSdkPath\\\": \\\".fvm/flutter_sdk\\\",\\n  // Remove .fvm files from search\\n  \\\"search.exclude\\\": {\\n    \\\"**/.fvm\\\": true\\n  },\\n  // Remove from file watching\\n  \\\"files.watcherExclude\\\": {\\n    \\\"**/.fvm\\\": true\\n  }\\n}\\n\")), mdx(\"p\", null, \"This will auto-switch the \", mdx(\"inlineCode\", {\n    parentName: \"p\"\n  }, \"flutter\"), \" version with fvm if one is configured.\"));\n}\n;\nMDXContent.isMDXComponent = true;","inboundReferences":[],"frontmatter":{"title":"Flutter","created":"2023-01-30T00:29","updated":"2023-01-30T00:29","tags":["garden","how-to","flutter"],"stage":"seedling"},"tableOfContents":{"items":[{"url":"#setup-the-main-flutter-sdk","title":"Setup the main Flutter SDK","items":[{"url":"#install-on-pop_os-linux","title":"Install on Pop!_OS (Linux)"}]},{"url":"#setup-fvm-macos-and-linux","title":"Setup fvm (macOS and Linux)"},{"url":"#ideeditor-configuration","title":"IDE/Editor Configuration","items":[{"url":"#vs-code","title":"VS Code"}]}]}}},"pageContext":{"slug":"Flutter"}},
    "staticQueryHashes": []}